{"$schema":"./nautilus-formal-completion-v1.schema.json","comparison_hash":"60b3083eaedf75a30b05217d8fd90b11ee6afab136727e80ef680d4fbe250989","comparison_id":"nautilus_v065_comparison_60b3083eaedf75a30b05217d8fd90b11ee6afab136727e80ef680d4fbe250989","conclusion":"INCONCLUSIVE_KEEP_CURRENT_CORE","files":[{"name":"nautilus-sandbox-comparison-v0.65.0.json","sha256":"b679261e72f0eb81364be2878dc4ef8813279f47b1f57d31b460032bd08a77e5","size":1423},{"name":"nautilus-supply-chain-receipt-v0.65.0.json","sha256":"11d15412ef7402434f3802fa380b7c4183de55a04d6ce025036d29c341ecc252","size":4307}],"marker_hash":"80c37c891741a2327c01cfc54ee98dca2a9d95ced5dcd0e0b22f19697994d0bf","marker_id":"nautilus_v065_completion_80c37c891741a2327c01cfc54ee98dca2a9d95ced5dcd0e0b22f19697994d0bf","plan_hash":"54f47c96500f3ab5688e629105777f74294370b1f6e957b1094bec896473f414","plan_id":"nautilus_v065_plan_85b7b8379ccbe4378d6495bc158f0151ca2dbd4cf5003326b5acd56241fe3bef","runner_invocation_count":0,"schema_version":"1.0.0","status":"FORMAL_CEREMONY_COMPLETED_VERIFIED"}
